Llevar una gran olla de agua a ebullición. Con una cuchara grande, añadir lentamente los huevos al agua uno a uno. Dejar cocer durante 10 minutos y, a continuación, vaciar rápidamente el agua de la olla y llenarla con agua fría y hielo. Dejar que los huevos se enfríen durante 2 minutos en agua helada antes de pelarlos.
Cortar cuidadosamente los huevos por la mitad y quitar las yemas. En un bol grande, mezclar las yemas con la sal, la mayonesa, la mostaza, la pimienta y el ajo en polvo. Revolver hasta que la mezcla quede suave y uniforme.
Repartir la mezcla de yemas en tres cuencos más pequeños. Para preparar los huevos amarillos, agregar la cúrcuma a un tazón y mezclar hasta que quede uniforme, y luego colocar la mezcla con una cuchara en 8 medias claras de huevo.
Para preparar los huevos verdes, mezclar las espinacas y las hierbas en otro bol pequeño de mezcla de yemas. Utilizar una batidora de inmersión para mezclar bien hasta que la mezcla se vuelva verde. Usar una cuchara limpia para trasladar la mezcla verde a 8 medias claras de huevo.
Para preparar los huevos rosas, mezclar el puré de remolacha y el vinagre en el bol de mezcla de yemas restante. Limpiar la batidora de inmersión y usarla para mezclar hasta que quede uniforme. Usar una cuchara para trasladar el relleno a las 8 claras restantes.
Servir de inmediato, o guardar en la nevera sobre una bandeja hasta que llegue el momento de servir.
