Esterilizar todos los utensilios y el interior de la olla antes de empezar, enjuagando cada uno de ellos con agua hirviendo o utilizando la función de desinfección de un lavavajillas.
Añadir la mitad de la leche de coco a la olla instantánea. Seleccionar la función para hacer yogur (consultar las instrucciones del fabricante para saber cómo hacerlo), que debe de empezar llevando la leche de coco a ebullición. Con la ayuda de un termómetro, comprobar que la mezcla alcanza los 60°C (140°F). Detener la función de ebullición, añadir el agar agar (o la gelatina) y batir hasta que no queden grumos.
Añadir el resto de la leche de coco y batir.  Cuando la temperatura caiga y alcance los 40-43°C (105-110°F), añadir el polvo probiótico (o el fermento). La temperatura puede tardar entre 25 y 30 minutos en bajar hasta este rango.
Tapar y selecciona "Yogur" a media presión y configurar el tiempo de incubación en 24 horas.
Después de 12 horas, destapar y comprobar la textura del yogur. Si se prefiere un resultado más intenso y espeso, seguir incubando hasta 12 horas más. Cuando el yogur esté terminado, retirar la tapa y el recipiente interior de la olla con el yogur dentro. Batir hasta que quede suave y verter el yogur en un recipiente de cristal. Refrigerar durante al menos 8 horas. El yogur se espesará con la refrigeración.
El yogur se conserva bien en la nevera durante unos 7-10 días.
